[
  {
    "frame_id": "frm-001",
    "label": "alpha-channel",
    "gif_index": 0,
    "key_version": 2,
    "key_source": "latest_assigned",
    "nonce_hex": "89099EF96B8D2C894091EEDF",
    "nonce_source": "derived"
  },
  {
    "frame_id": "frm-002",
    "label": "bravo-channel",
    "gif_index": 1,
    "key_version": 3,
    "key_source": "rotation_replacement",
    "nonce_hex": "267A3B911F8B35439968F9DF",
    "nonce_source": "derived"
  },
  {
    "frame_id": "frm-003",
    "label": "charlie-channel",
    "gif_index": 2,
    "key_version": 2,
    "key_source": "latest_assigned",
    "nonce_hex": "A7C3E91B4D2F8065E1B9C0A3",
    "nonce_source": "override"
  },
  {
    "frame_id": "frm-004",
    "label": "delta-channel",
    "gif_index": 4,
    "key_version": 4,
    "key_source": "rotation_replacement",
    "nonce_hex": "806586F8E145538DC6340B64",
    "nonce_source": "derived"
  },
  {
    "frame_id": "frm-005",
    "label": "echo-channel",
    "gif_index": 5,
    "key_version": 2,
    "key_source": "rotation_replacement",
    "nonce_hex": "51CF31D43093FBEB42AB08B3",
    "nonce_source": "derived"
  },
  {
    "frame_id": "frm-006",
    "label": "foxtrot-channel",
    "gif_index": 6,
    "key_version": 2,
    "key_source": "latest_assigned",
    "nonce_hex": "3F08D5621CA4790BEE17F2D8",
    "nonce_source": "override"
  },
  {
    "frame_id": "frm-007",
    "label": "golf-channel",
    "gif_index": 7,
    "key_version": 2,
    "key_source": "latest_assigned",
    "nonce_hex": "B4E19A7305C2D8F61E0A4B9C",
    "nonce_source": "override"
  },
  {
    "frame_id": "frm-008",
    "label": "hotel-channel",
    "gif_index": 8,
    "key_version": 2,
    "key_source": "latest_assigned",
    "nonce_hex": "C1D2E3F4029384758690A1B2",
    "nonce_source": "override"
  }
]
